SENTENCE	SLANG_TERM
Remember how Dad used to always freak Mom out and tell her all those stories ?	freak
I had a date with a guy last night , and we 're seeing each other again later today .	guy
Pick me up and turn me round	pick me up
I 've heard a lot about you .	lot
He said you ca n't fly direct to Tennessee , so he 's sorting us out the best flights cos he knows someone .	cos
Wobble , baby , wobble , baby wobble , baby , wobble , yeah .	wobble
- Your sister used the '' f '' word .	f word
Uh , about a week , probably .	uh
You 're never gon na do it again ?	gonna
Now , uh , there was a drug that the guy , the one who exploded , he had it in his trailer ...	exploded
I wan na tell you that if you know who 's involved , I do n't want any more trouble .	wanna
I work from home , but I stretch my lunch breaks .	stretch
You did n't even leave a note .	note
It was n't on purpose , but do n't worry .	stupid
Why did n't you just go to the police station in ... in a red clown suit ... and let everybody know what we 're doin ' here ?	in a red clown suit
On weed , and also on Ecstasy as well .	weed
So how come you never asked me out ?	out
Listen , where are we gon na dump the ...	gonna
Maybe I did n't fancy you then .	fancy
Toe up from the motherfuckir floe up !	toe up
And , consequently , there emerged this protest movement , if you like , ..... this new music , these new fashions , ..... which were more anti-American ..... and British in a slightly caricatured way .	caricatured
Hey , do you know what ?	decorate
If you 're having second thoughts , here 's the key to my Jag .	second thoughts
- No one sir , he 's a Saint .	saint
Suck a good ass dick .	ass
We 're still on for next week , yeah , bruv ?	bruv
Guys , check out the board .	guys
You 're shit and you know you are !	shit
I love you , sweet pea .	sweet pea
Though , given our history , I do n't know if this is such a good idea .	after all
You 'd better watch your grill .	grill
# It 's such a good vibration	good vibration
Jamesy Boy here , talkin ' me into bringing him back to their own crib , to plan their next move .	crib
You 're supposed to have my back .	have my back
We got hitched together by some crazy dude backstage .	hitched
AND IT WAS LIKE THIS -- THIS BANGING ,	banging
I 'll come back and I 'll bleeding ' well haunt you .	bleeding
I came right after you .	cooler
So no trigger , Just ouch .	trigger
So tell me , man ... am I close ?	snap
- A cave with a view .	cave
My cousin and her kids kind of come up here a lot .	kids
You know what Federov 's going to do when he secures the presidency ?	secures
The least you could do is give us a chance .	slaps
There is a kid everywhere .	kid
I swear to God , I did n't even know .	junkies
- What 's the matter with this guy ?	guy
We 'll be back on the road shortly , OK ?	ok
Just me , Sugarman the accountant , the cleaning girl .	cleaning girl
Yeah , I can see that .	yeah
( Man 1 ) All right , bruv , let it go .	bruv
I was out on the playground and I was kind of being picked on by this dillweed .	dillweed
I looked closer and there was something on Justin ... his anns and his face .	justin
I think I 'm just going to have a drink .	drink
I 've been in bad patches so many times and came home with so much stock little boys like you had to pack it on the pier .	stock little boys
Just because I 'm in such a dead moment .	dead moment
In any case , I want to talk to you about the future , about how we 're going to bring this over the top .	over the top
Always following me around and shit .	shit
IT 'S GOT TA BE IN THE CELLAR .	gotta
Never Ignorant and Gettir Goals Accomplished .	gettir
Carol is not a spider woman that I found in the gutter , Joe .	the gutter
# And you 'll wake up and make love	make love
- My God , I 'm so sorry .	my god
Listen , I got ta shoot , but there 's a card .	gotta
- Sweetie , so nice to meet you .	sweetie
Although temperatures have been within normal ranges for this holiday season , these temps are highly unusual .	temps
Anything you got ta say to me you can say in front of her .	gotta
Do n't worry about this , OK ?	ok
And I think a generation of Brits ..... who came of age in the mid- ' 90s really resented this .	brits
I 'm trying not to get scurvy .	boing
Yeah , now we 're getting there .	getting there
That was enough for , kinda , the world to go nuts for a little while ..... about London 's Second Coming .	kinda
All right , adopted when he was two months old .	all right
And all I need is a 110 grand , and then that way , I can keep all three properties in play .	play
Last fella who did n't went for a swim off the end of the pier .	fella
So if you could lower yourself to the level of the public , that would be great .	lower yourself
I think I felt it poking out my butthole .	butthole
Or she could have your job ... because you sure as hell do n't know anything about the game .	game
Proper deals going down , so ...	going down
Just ... just to give me a fighting chance .	fighting chance
See , when a player gets to the Majors , chicks come out of a deep freeze .	chicks
Hide the money , fake being jacked .	jacked
- Yeah , of course you did .	yeah
A Tale Of Two Kidneys .	tale of two kidneys
- She said she 's not interested in you .	frodo
- How did you get my Facebook ?	facebook
- Yeah , I 'm just a bit ...	yeah
Just screw him already , okay ?	screw
It 's the only thing generating proper cash for them banks nowadays , understand ?	them
Just give me your eyes .	eyes
You 're a good kid , Harry !	kid
But by the point that they got into power ..... it was pretty evident to me that ...	um
Cos see that man , there , Milky ?	milky
Come up in here wanting a gun	wanting a gun
I 've been down more than three years , I ai n't no fish .	been down
I did n't roll out here to ...	roll
And the thing is , Dr. Johnson , I have n't yet gotten up .	gotten up
I will say , she 's got a nice little set of tits on her .	tits
And that 's why she named me '' Lady . ''	lady
That was the line of the night , man .	man
You 're too busy banging the tarts .	tarts
So that 's why I did that Brit slut .	brit
So it used to be right tall and all kids could hide in it .	kids
You interns think of everything , do n't you ?	interns
Hi , yo I got plenty of time	yo
Do you remember there 's a scene in the car , the kids are scared and they 're looking at the glass and you hear the Tyrannosaur coming ?	kids
Annelle , come meet Clairee Belcher , first lady of Chinquapin .	come
Okay , let 's wrap this up .	wrap this up
He 's like the Zodiac Killer .	zodiac
Your girl tells you what to do ?	your girl
Would you mind telling me who you 're related to ?	family
- I feel your pain , Fi .	feel your pain
I 'll take one adult and one faggot .	faggot
I called you the DUFF .	duff
I 'm telling you that she 's my baby girl .	baby
I knew you were a bitch to him , but I always thought you loved him .	bitch
You ca n't put a price on looking good , chucklebum .	chucklebum
Hey , no first names if you can swing it .	swing it
I thought you were n't gon na take me to football ?	gonna
I-I just- I do n't know what happened .	that's correct
You got a baby by that punk-ass nigga Jody !	punk ass
After 12 days I to get out .	i to get out
Still managed to pull it off .	put it off
He 's probably high as a kite on your little farm , blood .	blood
I got to swing by Mom 's .	swing by
I 'm not as part of the dance world as you guys are .	guys
Convoy is holding at position Alpha .	alpha
So , in a way , you actually kinda brought this on yourself .	kinda
# Da bombs fuckir burstir in air #	da bombs
No , I do n't have any goddamn evidence .	goddamn
You take your dick , and slap it round a girl 's face .	dick
I am kinda kicking myself .	kinda
I 'm afraid have n't the foggiest .	foggiest
I want to squeeze you .	squeeze
We 're gon na use your guitar and your keyboard and write a new song .	gonna
Where was the highwaymanan , Dick Turpin , hanged in seventeen thirty nine ?	dick
Some of them man ai n't even affected .	ain't
- When did he redo the kitchen ?	redo
Whilst you sit on your sorry as with me all night .	as
'Cause he did n't fucking help you out , did he ?	'cause
Last one back 's a skank .	skank
300 grand to the penny .	grand
Your brother was a creep .	creep
And I 'm just a connect .	connect
You Just spread that love .	spread
Wow , getting a nice preview of what marriage is gon na be like with Ike Turner here .	ike turner
Charlie , you 've got a face like a slapped arse .	arse
Mom make you feel her tits ?	tits
`` Jamie , if you suck on my cock , I 'll get you an interview . ''	cock
I do n't wan na be that guy .	that guy
Yeah , but we do n't need you .	yeah
Let 's get this embarrassment over with .	embarrassment
And I called you an ass .	ass
♪ I wrote about every sight sore ♪	sore
i 'll get you some food and fags just gon na make a call , do n't go anywhere	fags
Why would I want to watch my kids play Little League ?	kids
Is this some kinda wind-up .	kinda
Now , I 'll not call him Clough , I 'll not take him down like that .	down
First thing I do when I get in the Majors ... is bang one of those chicks on Desperate Housewives .	chicks
How dare you say that my father had a wasted life .	wasted
They 're gon na revocate me anyway .	gonna
There 's stuff ... in the kitchen .	stuff
Remember how I told you they were gon na put me through management training at Weyland ?	gonna
It 's all right , it 's all right , a racist .	bastard
They rigged the tests to bring us together ?	rigged
It 's all good now , right ?	it's all good
You have a good birthday , you , all right , lovey ?	lovey
Well , I know I 'm gon na be	gonna
Now , fuck off back to Woody , you little fucking queer .	queer
- I do n't owe you shit .	shit
So what 's up with the results of the review of Dillon 's hard drive ?	what's up
Gon na buy myself a zoo .	gonna
The thing you have to understand is what happens in high school is gon na stay with us forever .	forever
Rescue 2-3- 1 , flight deck is green .	green
( Edward ) I do n't want any bloody magic !	bloody
I thought I was gon na get shot out in these streets .	gonna
[ Laughing ] I think the score	score
If Stromming is this Oz character , it stacks up .	stacks up
From the moment I met you , it 's been an adventure .	adventure
And give it to them , cos that 's what they fuckin ' want !	cos
Walk on , that 's what you need to do !	walk on
Look who 's got me pegged .	pegged
I hope you do n't mind me saying , but you are being a bit of a right old moody .	right old moody
You gon na sleep all day ?	gonna
I ca n't let my partner escort you out , we just became friends .	escort
He wo n't kick you out , but you 're dead in the water , honey .	kick
I mean , how big are twins ?	twins
Comes out of your nose , you got ta flick it off out of -- out of the pool .	gotta
Hey , we 'll catch up with you later , Chris .	catch up
We 'll catch our Ripper , not you , Mr Hunter .	ripper
Why you ai n't got no bullets in your gun ?	ain't got no
I do n't know how I got to the place where I 'm not letting you in but you 're right , I 'm not .	letting you in
It 's good to check a look at you again .	check
They take not up losers and skinheads .	skinheads
How long before they release me ?	slump
Did Annie ever forgive you for bailing on the party ?	bailing
They 're on the hook , Jake .	on the hook
There 's always a lot of girls around , you know , back there at the foundry there , at the ... on the lanes .	foundry
No priors , no history of online purchases .	priors
And by the way , you want one doctor to start writing Zoloft ?	zoloft
With a saucer , served from a teapot , with a bicky on the side .	bicky
I think I got ta go again .	gotta
That little fucking whippersnapper has set the standard .	whippersnapper
Who the bloody hell is that ?	bloody
- Sal , you look like shit .	look like shit
And when I win ya 'll going to take your black asses and walk back across that 248 and never come back to the FP ever again .	248
I love you too , honey .	honey
You know , maybe you wan na change your mind about going to one of those groups I mentioned ?	wanna
When you work a seven-day stretch on a offshore oil rig , seems like the only thing you want to do on your day off is sleep .	stretch
You 'll be the biggest sissy bitch on the wing .	sissy
I mean , seriously , Jenny , my Uncle Wayne is rolling over in his grave right now .	rolling over in his grave
'Cause his world is built ' round punctuality	built
Say , do you guys wan na get some lunch after this ?	wanna
IT 'S NOT GON NA HAPPEN , ALL RIGHT ?	gonna
It will all start again like when mam died .	mam
Why not take your shot ?	take your shot
It 's a little dinky , but it 's got the tarp underneath .	dinky
Kip , man , we gon na use a brick , man , we might as well call prison and make reservations .	brick
he had this little standoff shit where he would square off on a cat and he had this little slow rock .	shit
He 's down in the Belly now .	belly
These bathroom waits can sometimes take forever , so it 's best to hydrate .	forever
Next thing you know they pick me up , put me on the top of this mountain and they start chanting , and I realized they thought I was God .	next thing you know
What 's it like to be the only one committed to work while the rest of us are slumming ?	slumming
Maybe the picture was confusing me .	closet queens
This ai n't no free show .	free show
Yeah , well , maybe I need a new line of work .	yeah
Looks like he has pretty quick hands .	pretty quick
Hey , folks , I hope you are n't planning on going anywhere anytime soon'cause let me tell you something , it ai n't gon na happen , okay ?	ain't
- I told you where I was going .	going
`` Truth or Dare , bitch ! '' It 's what you said to Felix !	bitch
I 'll sort it , I promise you .	sort
I'ma strangle the both of y'all .	y'all
I know I look like 10 miles of dirt road .	dirt
And a million quid 's worth of lights , and of course , it 's going out live , but , other than that ...	quid's
That 's known as trouble with the curve .	curve
If I 'm holding your left ass cheek .	ass cheek
Go on then , off you pop .	off you pop
You believe all that shit ?	shit
BUT IT WO N'T BE ME NEXT .	gonna
I ca n't even remember , man .	man
Well , you know , just about the kids on the estate .	kids
- Bloody got one as well .	bloody
Try it one more time .	try it
I guess I do n't really ...	yes
( Man 2 ) Look at his eyes , bruv .	bruv
I 'll be down in a minute .	be down
What parent in their right mind ... seeing their child 's pain , their yearning for contact ... would n't take them in an effort to comfort them ?	take them in
Cats would be mouthing off to him , he 'd just , you know , keep his head down a little bit under the eye of the motherfucker like this .	mouthing off
I had that many chances and , you know , blew it .	blew it
It 's dead in the water .	dead in the water
HA HA , VERY FUNNY , NOW STOP IT .	ha ha
Honey , are you feeling alright ?	bullshit
At least my cum 's got its shit together .	got it's shit together
And I need you to be on top of the roof of the old hotel to be my spotter .	spotter
I 'd fill the place with exotic creatures , yeah ?	yeah
`` Your gaffer 's here , your gaffer 's here . ''	gaffer
Suddenly , luck sparkled in front of the world .	sparkled
- I do n't wan na go inside .	wanna
Just in case I wan na shoot somebody .	shoot
gon na be allright , they 'll be here somewhere which way ?	gonna
But he come at us , man .	man
* Tryin ' to make ends meet	make ends meet
I think I 'm gon na have to get you out of town or something .	gonna
♪ Dealers on speed dial Suckin ' all their papers	suckin'
I do n't know , I mean , you know , like , when you 're 17 and ...	like
Fine , it will cost you 25 grand .	grand
Because your loyalty demanded revenge .	actually attempted it
- Let me tick it for you .	tick
And we 'll see who 's full of what .	full of
- it 's not gon na make a ticket appear !	gonna
Man , we 're gon na have our own show .	gonna
Yo , I want to say , suck on this !	suck
We got movement definitely on Tuesday of that week .	movement
He looks like Duran Duran , both of them .	duran duran
- Oh , man , that was nothing .	man
Lost more men than Nam .	nam
I know you already gave an explanation , but I 'd like to hear it again .	there are no slangs in this sentence
FOR CHRIST 'S SAKE , THERE 'S A MURDERER OUT THERE .	christ's sake
How far are we gon na go ?	gonna
No , I 'm not gon na focus !	gonna
Give us a hand , will you ?	give us a hand
Listen , before I , uh , commence the launch code :	launch
Fucking cheap and easy , which makes us cheap and easy .	cheap and easy
It 's flip , it 's glib , it 's journalism .	flip
Beats a leg , do n't it ?	beats a leg
I do n't mean to be nosy or anything , but what 's a man like you doing at this hour passed out in a diner ?	nosy
- I met you back at the subway .	flower shop
There 's a street match comir up against The Triple Decka 1 K .	triple decka
You know I need 200 grand .	grand
I got to use our meager travel budget	travel budget
I wan na hear you beg like Trife did .	wanna
I mean , they 're both at McCallie Prep .	i mean
- He took a boost , and he blew it .	boost
Hey , are you sure she 's OK ?	ok
I have nothing to say for myself other than I must be temporarily nuts right now .	nuts
This guy I know , he 's gon na put me in some Internet start-up , sells shoes on line or some bullshit .	gonna
Listen , thanks for coming in , mate .	mate
He 's the , you know , the only real proper centre midfielder in the team .	real proper
You remember this shit , girl .	shit
Because I think you 're the red in her painting .	red
The shares of the major financial stocks plummeting .	plummeting
Everybody behave Like a gentleman ... because Lucy 's gon na come out here ... and first impressions are very important .	gonna
The darkness is gon na come for all of us !	gonna
# You 'd be my ho , you know ?	ho
♪ Moping and dragging my feets	moping
I 'll meet you outside Topshop in half an hour , OK ?	ok
You 're calling me a bitch ?	bitch
I thought it was cool .	cool
I want more than 200 quid	quid
Guys , sorry , there 's a bit of a glitch .	guys
Look , I 'll do anything for that money .	look
- You got yourself some scratch , what ?	scratch
Now that 's what I calla dead parrot .	calla
I know Phillip really wants to take him .	pass
Oh , for God sakes , William , put Mommy to bed already .	god sakes
You wan na smell my dick ?	dick
Oh , I love her , she 's an English rose .	english rose
All I did was call her dad a '' bender , '' and she hit me .	bender
I specialize in energy with a focus on ...	trader
My yoga teacher calls me a '' unique '' .	unique
However , it is also because they are kids .	kids
And so , after my ninth stint in rehab , um , Craig ...	rehab
Oh , you are so gon na miss all of this .	gonna
You do n't need to check the folks I deal with .	check
Yeah , managed to get everything finished , but I 'm absolutely shattered .	shattered
My mom always assure that the next move is gon na be the last one .	gonna
I hid it in the pram with the baby , innit ?	innit
But while you 're here you better watch your back .	watch your back
- So you can clean your stuff , man .	man
Basically , right , you 're taking a loved one behind , and just when you 're about to blow your load back of the neck , involuntary muscle spasm .	blow your load
... never try to teach a pig to sing because it wastes time and it annoys the pig !	pig
I want her to see Dr. Miller before she goes .	see
Dude , you 're such an asshole !	dude
I 'd rather be the bi-sexual ninja .	ninja
- Quit playing and give me some love .	quit playing
Where are we gon na go ?	gonna
Jim just taught me how to make the pitcher my bitch .	my bitch
With my brother Dane , and my mom Susan .	mom
Yeah , I like it long .	yeah
I finally reeled JTRO 's ass up in this piece .	reeled
Well , cut to the chase .	chase
No kissing and telling , buddy .	buddy
Am I gon na get four grand back off Ed ?	gonna
All right , get your arrow ready .	arrow
Um can I kiss your little cooty cat ?	cooty cat
Mum , give it a rest , will ya ?	hicock
Yeah , I miss you too .	yeah
People have no idea about the shit storm that 's about to go down .	shit storm
You made me see something out of my own head .	out
Do n't say that , you 'll make Mummy sad .	mummy
And you 're like still so beautiful .	like
I smell a Fineman jam session coming on .	fineman jam
I love the passing of time	passing of time
Okay , what is going on between you two ?	okay
Whether it sounds Neanderthal or not ,	neanderthal
It 's all a question of how bad you really want it :	shine
I never had a sister that looked like you .	you know what
I ca n't have the cops come to my house .	cops
Why do n't you come screw mine up ?	screw
Another thing I was wondering ...	waisted
Actually , that you can print !	print
He also says the Viagra commercials wo n't hurt his campaign to nail Heather Locklear .	dick
I get so depressed I need to wear high , sexy heels .	jogging
You got ta really swing the ax hard to get those , uh , hits in deep .	gotta
I do n't know why my mother ca n't get that through her skull !	get that through her skull
You just asked someone you do n't know their proper name to go and live abroad with ' em .	'em
Linda teeth maybe a large vocabulary but I do not light it .	teeth
Life in the old dog yet .	old dog
Harvey 's not a smack dealer , but he did time for it .	smack
Their blood 's all over your shirt .	blood
Here , Cyrus Rooney was a genius .	genius
- I used to moonlight as a pastry chef .	moonlight
See what I 'm sayin ' , cuz ?	sayin
Stop being so bloody noble , okay ?	bloody
About a hundred grand a year different , I should 've thought .	grand
Keep pressure on it , keep pressure on it .	keep pressure on it
For my peace of mind .	peace of mind
You really thought you was gon na come in here and take our shit ?	shit
Where did that word , college kid ?	college kid
And I will be in Scotland afore ye !	ye
Darling , I thought it was three days .	darling
Yeah , I 'm up for that .	yeah
Now , where the hell is my brother ?	where the hell
I do n't want to talk to ' em I 'm telling ' em	'em
You 're pricing me out of the goddamn game .	pricing me out
oi , hang on , twat ... - do n't be stupid you nutter	oi
Turn to your neighbour and say , '' Man , I love you . ''	man
Okay , okay , okay , okay , look , look , no more transplant jokes .	okay
You in a rush , blood ?	blood
We 're the good guys here .	stick
I 'm gon na go and get changed .	gonna
He was a teenage kid .	kid
I look like a prick .	prick
Did n't really ... realise that my , kind of , flippancy ..... was gon na have such , um , ...	gonna
Then there 's the big day .	the big day
Babe , how much is a gallon of milk ?	babe
- Lf I can lose it to Lili , I 'll do it .	lose it
So ai n't no one warned you about me , no ?	ain't
you ai n't gon na see that luv look , i 'll get it for you , allright ?	ain't
What made me piss my life away in this godforsaken place ?	piss
Oh , why do n't you ask our new head manager ?	jew
- Watch your mouth , young lady .	watch your mouth
They play poker , they golf , they do shit .	shit
So , are you gon na ask Anna out this evening ?	gonna
So now you go to the pet store and pick out two turtles , ' cause you boys are gon na have your own room .	gonna
Oh , God , it 's gon na stay in my head for the whole day now .	gonna
So you 're gon na come upstairs with me ?	gonna
- I do n't wan na think about it .	did it wanna
Your goons shot my little boy this afternoon , did you know that ?	goons
Sorry I 'm late , I just ...	uh
Yeah , well , Eric , bent as a twobob note .	twobob
I 'm sorry , there 's no work for you here , mate .	mate
It 's your stupid bastard Welsh fault !	bastard
I thought she was dumb .	dumb
So the old man turns to the elder and says ,	elder
He takes their briefcase and their topcoats , guards them , remembers without asking whose is whose , speaking as little as possible in all those acoustics , appearing at men 's elbows to hand them a towel .	acoustics
Wait a minute , wait a minute .	minute
She 's not gon na let us out .	gonna
If I jerk the handle jerk the handle	jerk
I 've got a family and I love ' em .	em
This is your new Mr. Bitchir ?	bitchir
So , uh , what brings you here ?	uh
You guys already have a bit of a following though , do n't ya ?	a following
I 'm on a flow at the moment , right ?	flow
So where do you wan na go , then ?	wanna
I am not about to open up a new can of worms .	open
Of course , I was always tempted to skim a lbit off the top , but I knew I had a good thing going and I did n't wan na risk it .	wanna
This here makes me absolutely crazy .	crazy
Fuck those racist crackers , man .	crackers
I do n't know what you 're talking about .	inherited
A pony on the first of the month for turning a blind eye to hooky MOTs is bad enough .	pony
Hust give him one goddamn break .	goddamn
I got a little shout out :	shout out
Not much to do in town , it 's pretty dead over there , and uh ... you know , we needed somethin ' to do .	dead over there
I think we should run the finale step , since that 's brand-new .	run the final step
Imagine the temptation to despair in the sound of carefree birds only yards from where you lay breathing in the weeds .	fella
Do n't worry son ... you wo n't do the seven ...	son
The Jody that got my boo pregnant ?	boo
About being degraded and brought to within an inch of your life , for example .	inch of your life
So she shouts , '' Hey , where are you going ? ''	hey
Yet on the other hand , they kinda did wan na be in Vanity Fair .	kinda
You need something ... anything ... just give me a bell and I 'll sort it , yeah ?	yeah
Sorry that we have destroyed your life .	destroyed your life
Who you calling a ball , dick ?	dick
♪ Oh , no , you steal ' em	'em
So , be careful , 'cause I could go at any second .	'cause
I 'd like to be a fly on the wall for that one .	fly on the wall
He has to be a dumbass for fighting my idiot brother .	dumbass
It 's un fair that we ca n't listen to our music .	promiscuous sex
