SENTENCE	SLANG_TERM
Are we gon na go to jail ?	gonna
You know , because once you go to L.A. , you 're gon na have friends like crazy .	like crazy
I 'm kicking you out ... so other people may eat .	kicking you out
# I 'm gon na punch that bitch right in the fuckir back #	bitch
I had the pleasure of scraping dog poo off Charlies football boots a toothbrush that I hope I 've thrown away .	poo
I 'll probably close the place down .	close the place down
- in a man 's life , everybody knows that !	man's life
Okay , then tell me the other half .	half
Well , can I come in ?	come in
Well , I want you drunk , so I can tell whether you are a lout or not .	lout
Is your family still around ?	none
My dad said if he ever caught someone going in there , they 'd be dead meat .	dead meat
It was no fun having doors slammed in my face , getting the evil eye on the street , being spat upon , punched in the face , and told I am a horrible person for deserting my pregnant wife .	evil eye
- Two weeks is a long time .	yeah
You 've had a few , have n't you , Mr Hunter ?	few
[ hoarse ] There 's a few quids ' worth of kit here .	quids
No , but they said they were gon na give me a little more time .	grand
If they can make alcohol strong enough to get you that wasted , they sure as shit should have aspirin strong enough to get you un-wasted .	sure as shit
You 're responsible for the shit they give me .	shit
I 've dreamt of walking in the footsteps of the great Svengalis of rock and roll .	svengalis
Those boss shirts that I 've been borrowing from Scott do n't even make Scott look like a millionaire , dude .	dude
And you , you have n't even broken a sweat yet .	broken a sweat
Pooch got the hi-roller suite .	pooch
Seeing as he did n't own a car .	bloody
But we got chance with the other Guvnors here .	guvnors
You were always good at that .	"t
around"
Nothing obvious , like a school uniform or anything crap .	crap
Because I 'm knackered , that 's why .	knackered
Wan na give me a fucking laugh ?	wanna
I ca n't quite pinpoint the exact moment when everything went south .	went south
Well , he crashed a party on some bad guys moving ' a half ton of coke .	movin'
Do n't be sad , you whiny bitches .	bitches
Nose pressed up against the glass .	pressed
John Dawson is king and do n't you forget it !	king
When it breaks my heart	breaks my heart
Some crazy dude handcuffed us while we were praying .	dude
He was a sugar daddy , for want of a better term .	sugar daddy
There is nothing I would love more than grandma 's delicious tongue on rye .	tongue on rye
These are all the lady tears that have been shed for you in your life .	lady tears
The past three years in a row ,	past
I gave her the memory of the child .	war
`` I have to move them out of the way of the kids . ''	kids
I asked ' cause I just met you and I did n't want to chaperon you old folks .	old folks
Unfortunately , there is no improvement .	deep water
He wants nothing to do with me .	do
Am I going to go too ?	spoil
Not as much as I do there , schlumpy shoulders .	schlumpy
He ​ ​ has some sick ideas about girls .	sick
If I stick around , you 're gon na try and get out of it .	gonna
I do n't wan na tell it .	wanna
The whole block gets shot up , y'all just sit there , do n't do nothing about it ?	shot up
Tough decisions are gon na have to be made by a wise administrator , someone who combines a listening disposition with attention to detail and compassion for her fellow man .	gonna
All right , do n't get cocky .	cocky
Your notes were awesome , Bernard .	notes
Well , what would you do if you were me ?	dump
Well , you know , I think you can thank your big brother .	guilotine
I 'm a shithead , believe me .	shithead
- Who the hell is this guy ?	hell
Robby , I got to call you later .	sell
It was just a hoof down the channel , and Coley just dinked it over .	hoof
She knows something is n't right .	resilient
I guess now 's as good a time as any for me to make my best man 's toast .	bear
- Feds is lookin ' for him , you get me ?	feds
People are shit bad at keeping promises .	shit bad
I want you all to meet an old chum of mine .	chum
- Whittier , quit worrying and enjoy the sunshine :	enjoy the sunshine
Scramble-egged his leg in a bike accident .	scramble
Count the headlights on the highway	headlights
But please do not to take this out on Lucas , okay ?	okay
We got ta clean this up .	gotta
- I hope you flip your bike over and knock your two front teeth out , you selfish son of a bitch !	son of a bitch
- Yeah , you got an upgrade ?	upgrade
You 're down the fucking gym .	you’re down
Nah , he still sees ' em .	nah
Mesdames et messieurs , I give you the delicious bon bon of the French Riviera , Dominique du Monaco !	bon bon
I 'm warning you though , you 're about to think that I 'm really cool .	cool
Well , gents , the emcee is profoundly privileged to be here and is exceedingly happy to see you all looking so dapper .	gents
I want him dead today .	him dead
Let 's go , or you 're gon na get arrested , come on .	gonna
Away above the chimney tops	melt
You spend half your life in that subway scoring and shooting up , or whatever it is you do down there .	scoring
Well , yeah , you 're right and I know that sometimes I talk too much .	yeah
But I am far gone in age and decrepitude .	far gone
It 's bloody hard work , that 's what it is .	bloody
What makes you even think you 're the daddy ?	daddy
Someone 's got a big mouth .	big mouth
Because , I mean , best-case scenario , your career as a journalist is gon na be over because this is all anyone 's ever gon na remember you for .	gonna
I saw the man , the wee man himself , Napoleon ?	wee
What they did n't tell anybody was that was a lie .	lie
I 'm sick of your cheating on me , Jody !	sick
I do n't like that , gives me the creeps .	creeps
I do n't know , I guess I 'm missing something .	really
We just came for the free booze .	booze
So , what 's it gon na be ?	gonna
You smoke this shit and ...	shit
I could n't hold out any longer .	hold out
We stick to the plan .	stick
Yo kicks got smiles humped all up my face .	deluxe
I think that 's his kid Leonard .	kid
Aye , Mr. Hare , yeah , that 's exactly what happened .	aye
Just gon na go in around the back .	gonna
Getting stiletto shoes and proper clawing him with ' em .	'em
It 's starting to freak me out .	freak me out
Resortir to meth and shit !	resortir
Do you know the leverage effect ?	leverage effect
She 's working on a little indie film .	indie
You have been in the wars , have n't you ?	been in the wars
That means these guys have to know that they ca n't get a nickle out of you until we first know that she 's okay .	get a nickle out of you
Sneaking around Kim and her mama like I 'm a child .	mama
Pete did n't even let me get through my pitch .	pitch
Stand up for the people of America	stand up
His chute was damaged by enemy fire , and he lost control and landed on the roof of a house in the middle of the country .	chute
She always was a ballbuster .	ballbuster
I ca n't tell one from another	you find me
While you look like a bible salesman .	salesman
I did think he was gon na toss youngblood over though .	youngblood
Yeah , but not as nice as forking .	forking
I mean , she says they 're OK .	ok
The thing about sat nav is , you do n't where you 're ... you have no sense of geography .	sat nav
- Hey , you got a second , Top ?	you got a second
# With punchlines , funny how I fuck dimes #	dimes
I ai n't into all that stupidness .	ain't
- Deep down , you 're a big sweetheart .	sweetheart
Oh , and that 's why you fall .	twisted
They want to have you evaluated by a shrink ...	shrink
- He is willing to face down	willing to face down
# Would n't try to bite # # when she calls your name #	bite
It was disaster for the club , Roy Keane missing it .	disaster
Thank you so much , officer .	yes
I am really really glad you 're here .	glad
You said , '' '' The most valuable commodity I know is time . '' ''	commodity
Darling , I do n't actually have my gift with me .	darling
So what you act like tings is gon na run for then back out ?	tings
Them 245 bitches is whack !	bitches
I ca n't find you , and now I come to you with an idea put myself on the line , you shoot it down with negativity .	shoot it down
Their motto is '' If it ai n't Stiff , it ai n't worth a fuck ! ''	ain't
I struck out my first time having sex , got PID .	struck out
Do I look like an asshole ?	asshole
I said hold that shit !	shit
Bet you 'd like to stick your dick in that , huh ?	dick
- J.J. , you tail him , all right ?	tail
I pop ' em like candy .	pop em
Gentlemen , join our band of brothers .	band of brothers
.. Put up your dukes Let 's get down to it ..	dukes
And there ai n't nothing that helps a reelection campaign in the state of Texas like an execution .	ain't
Right , and look how you turned out .	turned out
Ty , he 's not gon na make it .	gonna
I knew right then that she was n't gon na be a kid any longer .	gonna
If you wan na communicate with me do it through your lawyer .	wanna
I feel like he 's looking at me and he 's thinking that I 'm trying to be white or something .	white
- Ask him what he wants .	pieces
Seems sort of like an ordinary guy .	guy
- They 're off to by crack .	by crack
Oh , he 's going to town on me , Toby .	town
All right , hold it down .	hold it down
Have been colonized by your rapist .	colonized
That was the beauty of The Cliff , was n't it ?	beauty
# Up your ' arris , in your mince	'arris
Uh , this is -- this is Becca .	uh
- In my man 's hood , the boy had the nicest pair of hands in the whole neighborhood .	hood
I do n't care , just get in the car , will ya ?	ya
No one can help these slags .	slags
First Dad screws me over , now my brother screws me over ?	screws me over
We 're just blocking his gateway to hell .	gateway to hell
How am i gon na get you to Devon ?	gonna
You need to check him .	check him
Er ... yes , it 's a bit on and off .	er
Been Nathan 's teacher for seven years , I wan na see this through .	wanna
You know , I swear someone was helping me , though I just ca n't bring it together .	swear
- No , thank you , I 'm working .	vinnie
They raffle off the right to carry my books to class :	raffle
We have n't seen him hit a baseball all year .	bum
- I say we go for it .	go for it
Because I want to take in Bolton Abbey and then quickly say hi to my parents .	hi
No , what we 're talking about here is your basic secondary type of fella , the fella that thinks he 's a great lover , your sensitive male smoothie type .	fella
Sam , you do n't actually have a choice .	shrink
You 're gon na get me fired !	gonna
You ai n't the only one who lost BTRO .	btro
'Cause I got dizzy ... twice .	dizzy
I make more in a month now than I did in my best year as a nurse .	nurse
I suppose that 's a shame .	that's a shame
Listen , man , if she ai n't on the streets ,	ain't
- Yeah , I 'll believe it when I see it .	yeah
It 's the worst gig we 've ever played since Sidcup Crematorium .	gig
Brought the old ball and chain , what ?	ball and chain
- It 's how it is or it all goes tits up .	tits up
We got ta go kill somebody .	gotta
No , girly , you do n't know	girly
Do you wan na look at our hole ?	wanna
I miss my mum and all the kids and funnily enough , I quite miss me dad and all me mates .	kids
This is Bads , we used to kick the fuck out of eachother .	bads
No , but really , that 's one of the stages of the thing , of using the Asset .	kiddin
I 'm talking about trigger-happy lumps with machine guns .	lumps
Kids eat some cake and we lift the grim bloody pallor of mortality for a few glorious moments .	kids
And some of the people that you meet on the road ... are really amazing people .	road
She also said you need to increase my allowance to 5 dollars .	allowance
And to you , Harry , this $ 500 chip out of my own pocket .	chip
Three to five feet of snow , maybe more .	maybe
♪ They 'd rather wait Until I 've turned my back , no turnin ' back	turnin'
I got ta open up to you .	open up
Sweetheart , she 's never gon na disappear .	sweetheart
Better hold your next words real close , Pace .	hold
I 'm gon na try to get a signal .	gonna
- Run ' em out of town ?	run'em
That bitch can never keep those titties legit .	titties
Okay , you need to work on your finger flexibility .	okay
Welcome to my world , to the excruciatingly erotic world of Wild Velvet .	it is veryuseful
- Was gotteskind looking at Kenny kristo ?	gotteskind
Anita Addison said he got off because he joined the military .	got off
♪ Anytime you feel downhearted ♪	downhearted
- I know the bloody feeling .	bloody
Everybody knows you used to shit yourself around my old man .	shit yourself
[ Davey sings'Every Time We Say Goodbye by Ella Fitzgerald ]	i die a little
I was thinking about Charlie , lying in there , shitting himself at what 's just happened to him .	shitting
Of the shit that is all around .	shit
To being in our house and hanging out with us and for making a great meal .	hanging
Hey , honestly ... this town sucks , Sean .	sucks
If you get into a jam , you can call me .	jam
I thought Carl was going to have it off your wrist .	going to have it
Relatives are as strong as blood .	strong as blood
You 're a real charmer , you are .	charmer
* I am too busy losing myself in my mind *	mutters
Oh , yeah , B . Bringing that shit in 90 % pure .	pure
I told you , you speak again , I 'm gon na knock you out .	gonna
I think she decided that whatever was in me now was dark and ugly and better left where it was , as long as it was not near her and the kids .	kids
So , now that we have our man , let me say a few words .	few words
Get lost , you bloody queer !	bloody
* Drag boy , dog boy , dirty numb angel boy	drag boy
Are you gon na give me a hand ?	gonna
You freaked me out so that I would see something .	freaked
The others have devoted more time and resources than you can imagine to developing an ability to pass from one side to the next with no success .	my fist and then daves dick
We 're just messing about , right ?	messing about
- Just take it easy , take-take it easy .	take it easy
Cops wo n't confirm whether there 's a link to the al Qaeda terror group ...	link
Now where is the other thing you were talking about , cuppa , cuppa , cuppa ?	cuppa
So you 're the kid who 's sent me those articles from the school newspaper .	kid
Okay , Norman , you are calling me for pinochle .	pinochle
Look , Bretton is not an enemy a kid like you wants to have for life .	kid
- This is my family , innit ?	innit
I do n't think anyone can really explain rock ' n ' roll .	rock' n' roll
- She did n't take your phone , innit ?	innit
- guys that ca n't get laid .	laid
If you write about something that 's happened , you 're not gon na lie and say , '' It did n't happen , '' when it did all the time .	gonna
It 's just , '' magical comfort food for the weak and uneducated '' ?	comfort food
In a get , you get to get rid of the entire schmuck . ''	schmuck
What the bloody hell is that ?	bloody
You see what your lads are doing ?	lads
And not the hot kind .	hot
And I went up to him and I said , '' Give my band a gig , top of the bill . ''	gig
No , it 's Saturday , you moron .	moron
♪ With the boy of my choice if he makes me go '' Ouch ! '' ♪	couch
So Doc how long will this episode gon na last for ?	gonna
♪ Wan na be actors , they ca n't act as well ♪	wanna
You should 've seen O'Hare 's first .	bastard
Now , this is what you call a real lead on a real suspect .	lead
Five grand , you can have ' em .	grand
- Can I get a bump ?	bump
'Cause you 're already better than anyone there .	'cause
Nah , when you 're done fuckin ' about , yeah , you call me , yeah ?	nah
orita tried to execute her life twice , man .	thats great
That 's what an ass will do .	ass
When you use equal goods or services instead of cash .	cash
Frank , you and Carl hang out .	hang out
We 're not gon na let the bank take your house .	gonna
- The city does n't wan na make a big case out of this .	big case
It got nicked in the end , the car .	nicked
And eventually , he resorted , after periods of unsuccessful counseling , to the practice of handcuffing his own wrists behind his back whenever he would lose his temper with any of us .	handcuffing
Truvy , can you make some quick magic ?	magic
Why , do n't they have three inches of piss in the dressing rooms ?	piss
Try getting jacked off under the table in front of the family and have some real problems .	jacked off
- Now come , we need to talk , huh ?	huh
Do n't wet your panties , Josh .	panties
Shoes , 300 quid , come on .	quid
- Hey ... there 's acid in the beer that 's in the red cups .	acid
- What else are you gon na ban ?	commercialized
'Me and him spent a lot of time together cos his dad is a right miserable bugger .	cos
- You think you 're a big girl ?	big girl
And by us havin ' it , ..... hopefully some other people will learn how to have it .	havin'
- What seems to be the problem ?	fired
Your story was more interesting .	you're gonna die
I go by '' '' Bretton '' '' these days .	days
- Mark , you better not be driving .	driving
and saying the other one 's cuter and all this stuff , and , uh , Maggie asks how old her son is , and she gets down in front of the stroller and says , '' Hi , little monkey ! ''	monkey
Is there any way I can come see you some time ?	uh
I put them through hell .	hell
You got to be brave , all right ?	all right
But I thought maybe I stepped into it wrong .	zipped
he said to follow- i know , i fucking know , ai n't i ?	ain't
And I swear if I put a cup of tea on the sideboard , you 'd see the same ripples in my tea .	boom
But we can probably just swig out of the bottle .	swig
There is 1.6 million quid in there .	quid
Okay , look , when you said that we should hang out Friday ,	okay
I did n't know he was gon na say all that shit .	shit
These investigations , they make you popular with the West Yorkshire lads , did they ?	lads
Umm , tickets to cirque du solei for him and his family .	cirque
- You got ta be out of your minds .	out of your minds
Put them in the hole , all right ?	hole
You got the easiest job on the boat , and you manage to screw it up !	screw
I wan na see you guys .	guys
I 'm sure people think we 're gay .	gay
♪ Been at a house party around the way Doing illegal shit but he 's just a kid	kid
I 'm gon na kill you , blood !	gonna
The problem is you date a girl for two weeks , get her to fall in love with you ...	fall
I wo n't ever get flat .	flat
I ai n't having ' it , pal .	ain't
- Ho , shit , what up , Sean ?	ho
'Cause I 'm having a shit day , and I 'm ready ...	shit
Boy , do you look guilty .	boy
`` Lovers long for the moment their souls may blend in a whisper . ''	blend in a whisper
When I rock like this rock like this	rock
Okay , folks , Nothing to see here .	folks
Blowing up stuff always helps .	blowing up
- Beth , go left your jumper .	jumper
I thought you guys were gon na wait for me ?	gonna
You want to do this shit ?	shit
You and me ... divorce ceremony .	ceremony
So I do n't see you in a couple of months , yeah , and you got yourself a girl , blood ?	yeah
But you have to promise not to get mad .	mad
I invited the woman in , I shut the door I hopped on the desk and I just let her do it .	hopped on
I 'll give you six for both tings .	tings
♪ La-la la la-la ♪	la la la la la
- Oh , aye , what 's that called ?	aye
I 'm a pussyhole cos I 'm not doing crack ?	pussyhole
You swore on my life you were gon na leave this alone .	gonna
'Cause Coleridge was off on his travels .	cause
Want to come with your daddy ?	daddy
I gave them bad guys .	guys
We can just get this a little more ...	yeah
Give him a chance , man .	man
Do you remember Kiddo , after you had been left out ?	kiddo
We 've got something real , girl .	real
One of us has got ta lose some weight .	gotta
That 's a very smart stay .	smart stay
I never made any money shorting Hydra .	shorting
My partners get pissed off and they leave me holding the bag , that 's it , I 'm done .	bag
Do you see how open I 'm being with you here ?	here
What 'd you expect , you 're gon na win this job , with all the rewards that come with it , by giving them a little simple written answer ?	gonna
kids ..... um , smoking so much dope , and taking so many drugs .	kids
Something I 've always kinda wondered is , is it the same guy I 'm talking to every week or there 's a few of you and you switch off , or ... how does that all work ?	guy
Uh , he 'll be pitching to you .	pitching
Chum , come and pick me up	chum
Well , look , I 'll sign this for William , okay , if ... if my friend and I can go take a look at Dove Cottage .	okay
You think you 're up for all this , Pete ?	up for
Come on , I 'm just playing with you .	playing
Hooks up with the first attractive woman who he meets .	hooks up with
There 's no more room at this inn .	inn
I can just make sure that it ... that it ... it stays very , very steady .	steady
.. Hit me with your best shot ..	hit me
♪ Anytime you 're feeling blue ♪	feeling blue
Do you really think the sun about giving up the most important thing	sun
- Oh , you 're gon na cover me ?	cover me
- Then she got serious with mine .	got serious
So , there 's this person I like , but I know how bad I 'm gon na get	gonna
You could have broken up with her .	broken up
I 'll stick it up your fucking arsehole and rip your fucking hair out , and you 'll fucking love every fucking minute of it !	arsehole
That 's why your boyfriend shagged around .	shagged
Just wait till Daddy hears about this .	daddy
You 're missing out on something , but ...	something
You do n't need Daddy to be here for you ?	daddy
She was always a big girl , but she would not stop eating the shit that was killing her .	shit
For God 's sake , Toby , that does n't mean you just bring her back .	for god's sake
Can I have a word please , mate ?	mate
I 'm not done yet , Monica !	cheerleader
Let 's done start Got ta ti// the ground	gotta
Why do you keep looking at the clock , blood ?	blood
Say that he is ok .	ok
♪ You could get lost in this concrete jungle New builds keep springing up outta nowhere	concrete jungle
Is it 100 percent goose down ?	goose down
Like , we wear Firebird monster costumes .	like
You schooled by a little girl	schooled
He said , '' Truth or Dare , bitch . ''	bitch
We are the murder weapon .	weapon
You 're chatting shit there , bruv , I do n't know what you 're talking about .	chatting
When she was little , they said it was gon na go away but it never did .	gonna
Did n't march halfway across the world and put Jerry back in his box for jumped-up spivs to end up running the show at home .	spivs
Mmm , no , it seems to be OK .	mmm
Mrs. Tischler 's gon na give us a second chance .	gonna
Well , if Dad spent more time with him then the memories would n't have to be so '' lasting . ''	lasting
Be a ghost and be a legend at the same time .	legend
# Not a tear but a cheer , make it gay	gay
All right , bruv , let it go .	bruv
Once our work is done here , we 're gon na burn this place to the ground !	gonna
You want to know the way I see it ?	valid
I do n't wan na do this !	get there
Somebody raped your girl , man .	raped
It 's like she sort of cleaned me out or something .	cleaned me out
I do n't wan na say sleazy , because that 's not the right word but a little irresponsible ?	sleazy
Man , I 'll do anything for you .	do anything for you
- I might just pop off to the toilet .	pop off
He said the regiment were n't the same since you left .	mate
- Oh , it 's gon na be great .	gonna
You would n't mind keeping an eye on them ?	keeping an eye
And I just thought , '' Nah , I 'm not having it .	nah
And I 'm smiling to myself because of the surprise I have in store for you .	store
It 's not as big as yours , but , yeah .	yeah
- I do n't wan na talk about it , Walt .	wanna
- You going to the bookies later ?	bookies
This one kinda looks like a hand .	kinda
She really wanted to be here , but she could n't change her shift .	really
Not so much ' cause we 're right by the dumpster , and the trash guy forgot to stop on our street again .	dumpster
Man , chill the fuck out .	chill
What is it you like of Greek tragedy ?	shades
And it 's gon na kill you .	gonna
Come on , Penny , join us .	vacation
It 's unfair my boy 's got a slapper for his mum .	slapper
I 'm not about to give up the one and only chance I ever had .	mangy
- I dropped her off to my mum 's .	dropped off
¶ That 's what we do with a drunken sailor ¶	drunken
First , you tell me ... did you sleep with her or not ?	sleep with
It was over when the Russians made her .	made her
So many girls hurt in that house .	many
# If I ever shaped up tricky	shaped up
Let me tell you something about people like me .	little
From everything you told me about him , he sounds like a kook .	kook
We 're supposed to make each other feel safe .	what the point
I 'm coming back to Paradise .	paradise
I ai n't got nothin ' but time , baby .	ain't
Saw every last peppy pigtail that passed through this place :	peppy pigtail
- Yeah , I do , as it goes .	yeah
# Sir , come on and put the charge on me	put the charge on
Go and pull something now , yeah ?	yeah
It does n't seem like I 'm the only one who 's gon na be doing the talking this evening .	gonna
I met a lot of girls .	girls
You had to chat someone up .	chat someone up
I just wanted to play a part , but I never thought I could	till
Well , I 'm saying what are you gon na do for the camera ?	camera
Yo , man , why you asking him first , man ?	yo
So they 're splayed a little more .	splayed
She 's got rules against this kind of thing :	rules
Hey , it was fun watching you up there tonight , man .	man
I ai n't gon na fuckin ' walk around with it .	ain't
- And a wicked girlie weekend together .	girlie
Then , just when she begins to think that you 're another , you know vanilla-nice guy that she can tool around with all night without getting naked you insult her .	vanilla
For being such a jerk to you when you woke up today .	jerk
Yeah , but it do n't seem right .	yeah
