SENTENCE	SLANG_TERM
I wan na know what happened to my friend John .	well hes gone
It 's better for flirting , not-so-accidental touching , making out .	making out
I , er ... need to know the competition .	er
That 's the dynamic we agreed on .	dynamic
The man mountain , the yodeling flingy .	flingy
You got ta get them back .	gotta
I wan na see my kid and ....	kid
Oh , yeah , I remember you .	sorry
`` You 're gon na grow up to be such a pretty young lady . ''	gonna
You boys look like you got busted in a brawl in Scollay Square .	busted
It 's exactly what I needed .	what i needed
Ai n't seen her for a while .	ain't
♪ There 's such an air of spring ... about it ♪	air of spring
You calling me a gold digger ?	gold digger
The old Mick , you 've only gone viral .	viral
Look , I was just wondering whether I could bring a few people down to the gig .	gig
This has been too much academic debate for one day .	academic debate
Well , yeah , I 'll tell you what , I 'll give you a tape .	yeah
That 's right we ai n't got all day .	ain't
She 's the most beautiful thing I 've ever seen in my life .	beautiful thing
- Well , your ball is in the rough , but it 's a good feeling , huh ?	huh
I did n't come to be lectured by some cocky little twat from the North East .	cocky
Looks like massive PE , and his right ventricle is starting to give out .	pe
# Black hair , white Strat , bled white , died black	strat
The hell with it , right ?	hell with it
Well , they 're just plain wrong .	plain wrong
What 's going on with you ?	what's going on
Not that strong if you 're talking to me .	talking to me
I 'm going to the store , '' There a bitch at the store ? ''	bitch
- It had to be a girl car .	girl car
You blow your horn and wave to the lighthouse keeper 's kid on Thatcher Island .	kid
Which means we 've got ta get it right .	gotta
Yeah , but that 'd be weird .	yeah
♪ He knows Kirby 's upstairs Bangin ' his mum	bangin'
He wo n't have to run about so much now , will he ?	fat bastard
Even in nature there are blended families .	blended
But what I need you to do is relax .	kids
I 'm not so sure I wan na do it either .	wanna do it
- No , I do n't buy it .	buy
I knew you were cool .	cool
bring his ass over here !	bring his ass
You got ta learn the difference between guns and butter .	guns and butter
Ca n't be half as great as mine .	minds blown
I 'm not blessed with much fashion acuity , but I know a plonker when I see one .	plonker
Cos he used to stand up like that , looking at you .	cos
He tells her that the French government is screwing everything up .	screwing
Bretton James ' division was over-invested in the Internet bubble collapse .	internet bubble
I want you to have a good view of the show .	good view
Yep , I love you too .	yep
Get out of here , man .	man
I thought that would get you .	get you
Hackett , hold up a minute .	hold up a minute
Move , man , move over , dawg .	dawg
Cos you wanted this yesterday , brother .	cos
Look , I was going to cook myself fish fingers and watch the match on telly .	telly
We 're kind of like an underground railroad and shit .	underground railroad
- Oi , do n't ask about that shit , bruv !	oi
Said they played like thugs .	thugs
Not if I talk to your professors and they agree to flunk you .	flunk
Oh , I bet you 're just stunned , right ?	stunned
They want him , and they 're gon na say that you 're not fit to care for him .	gonna
And I mean that from the bottom of my heart .	bottom of my heart
Then you take your bra off the side .	smack
If we keep our cool , this thing could still work .	cool
Did you have a good time with your daddy ?	daddy
The bellhop confirmed he was the billionaire media mogul Hobbs , and , $ 1,000 bucks later , he gave me his room number .	bucks
I 'm going to give each one of you a year or two of the investigation and 24 hours to get to grips with the files .	get to grips
Run the game with me .	run the game
So anyways , I got my sights on this new one .	sights
- He got stuck in a radiator .	stuck
Then I 'd suggest you see to your duties before you start galavanting .	galavanting
You know , they say parents are the bones on which children sharpen their teeth .	bones
When our car broke down , we kind of got lost .	broke down
I 'm a little tired , I 'm a little wired , and I think I deserve a little appreciation .	wired
And how long 's that gon na take ?	gonna
- I 'm not gon na talk to him .	gonna
Skipper say anything about us coming up short ?	skipper
I 'm not really planning on busting up out of here	busting up out of here
You know , like , embrace the team spirit .	embrace the team spirit
And you 'd sooner fester down there with all those bloody Tories in that blue- rinse retirement home by the sea ?	bloody
They 'll need to make the next change-over count .	slipped
Do this deal and I 'll see nobody knows about you .	deal
It 's all right , babe , we 're almost home .	babe
just make us look cool .	cool
You 're funny , you 're articulate , you 're smart .	true and true
And that is really cool .	cool
How long you gon na keep me in here for ?	gonna
Until then , you 're an old guy in the 20s .	old guy
I told Penny this morning 51/ 55 for the bridge , but I did n't say anything for the front , but ...	bridge
With a hell of a crew .	hell
Oh , it 's just up a ways .	just up a ways
I do not play games , little girl .	play
( Billy Two Hats sings in blues style ) J * The bottom line is I 'm all messed up ...	messed up
Kid 's hitting 350 , ready to move to Double A .	kid's
Hell 's yeah , I would have had your back .	hell's
I 'm supposed to think you grew a heart .	grew a heart
Yo , let me hit that .	yo
- But you got that look .	that look
We can strip down and shine the hood .	strip
`` I 'm not sure I can handle complicated '' ?	complicated
I ai n't trying to be his father .	ain't
And would you like a cup o ' tea too mate ?	o'
The day you arrested him , got six of your mates to put him in the van while you watched , like the pussy'ole that you are ,	mates
Mrs. Stromming , can we have a word ?	word
some jerk locked up in the Jersey Prison .	jerk
- He 's got ta be so embarrassed .	gotta
We 're planning on yanking $ 42 million .	yanking
I 'm sorry , but , you know , you ca n't barge in and expect to become one of them in six months , either .	barge
Things are gon na be good now .	gonna
All right , I 've got you .	got
Yeah , come we play this .	yeah
Yeah , we 've got a couple of suits you can give a go .	yeah
If that thing is , like , a piece of shit ...	that thing
So , last night was good fun , were n't it ?	weren't it
Not your unremarkable life story .	life story
I still gon na give you a neckline as much as I can .	neckline
I mean , it 's got to bug the shit out of you , too , right ?	bug
I would love to go , but I 'm a disaster .	disaster
Look , sweetie , I 'm gon na go , OK ?	sweetie
Legend has it , when the Santa Anas blow all bets are off .	bets are off
I was n't taking the mickey , Scott .	mickey
- Think I 'll have to sit this one out , eh ?	eh
♪ Gal , you sure look good to me ♪	gal
- Do you ... have any experience with , like ... demonism ?	demonism
Uh , sort of like a ...	sort
The tricky part is , if you separate them , it feels like the end of the movement goes down , because it gets darker , you know , by making a richer back ...	tricky
Take it easy now , tj .	plumbing
Tell me I look beautiful .	i look beautiful
[ Lowers voice ] Can you pay , Toyland Toyland .	toyland
Oh yeh ... they had a dirty trick up their sleeve	yeh
Ah , and you are the boyfriend ?	ah
Honey , but when you 're near me	honey
♪ I 've been such a drag	drag
Well , who would have thought it .	who would have thought
I need you to feel what I knows .	knows
BTRO was my best nig , yo .	nig
So , Felix ... tell me ... if you had a golden ticket ... and you could pick any girl ... or any guy ... to take upstairs for a very quick , no strings attached , no questions asked shag ... who would it be ?	shag
Any chance you can get me any weed ?	weed
From the looks of it , the only lifelong commitment you 'll have is with your right hand .	right hand
Hey , I would like to check these out .	check these out
Again , she can not just barge in here every time she loses her glasses .	barge
- Horse , have a pint with me , son .	son
Cops get anything out of Decosio ?	cops
It 's not going to work out for us .	keep it light
Then big brother takes the fall for the slip-up .	big brother
- A nice wife and some nice kids ?	kids
So you just watched while Chris pushed him around ?	pushed him around
And that is why they pay you the big bucks .	big bucks
... report that the subways and buses are starting to run , as well .	starting
You do n't ask for much do you , eh ?	eh
Okay , he 's not joking No , no , no , no , no !	okay
Woody said if I come within five feet of you , he 's gon na kick the shit out of me .	kick the shit out
You disgusting little French fop !	fop
I think I 'm gon na take off .	take off
They 'd make me boss'cause I 'm next in line .	'cause
No , I ai n't got it , but ...	ain't
Shoulda seen your brother , man .	man
Or I 'm going to burn that shit hole of his down , with him still in it .	shit hole
♪ I ai n't got no rules ♪	ain't
Yeah , let 's not be doing the Sweet Romance douches quite yet .	douches
Come on , Unc , let him go , man .	unc
I 'm fine Are you okay ?	okay
He 's turning left at the junction , you take him , yeah .	yeah
He said he missed out cos he was too fast .	cos
Company went through the roof .	through the roof
♪ I wan na know Why they 're gone in the morning ♪	wanna
What the hell 's going on ?	going on
What the hell was I supposed to do ?	what the hell
Do n't be stupid and pass this one up , kid .	kid
I gave you money to get a proper motor , not this piece of shit .	shit
So , without further ado , I want to announce today ... that ...	hears
especially because your moving out here was something I lobbied so hard for .	lobbied
Did you wake up one morning and decide that you 'd hit rock bottom ?	rock bottom
You should 've taught him if he 's gon na play with guns , he should learn how to use one .	gonna
And it 's been , like -- like 20 years .	like
- Oh , he plays a superhero in this one .	superhero
... Found her bed empty and the screen on her window removed .	yes
- Might as well jack him .	jack him
It 's been the best day of my life .	aw
- Pete Hastings , eat your heart out .	eat your heart out
Stand up for the people of America	stand up
Let me hold it , dawg .	dawg
It was our future , and I did n't want to give it to them .	bullshit
I 'm heading up the transition team that 's going to help you , help all of us understand exactly what you 've been through .	head
- Is he lucky I 'm off the market or what ?	off the market
Come on , I got this , man .	got this
Because we 're all gon na meet back here on Monday morning and I 'm going to let the two of you decide .	gonna
- Just give us two minutes , boys .	boys
Well , things are definitely screwed up .	screwed up
Jesus , you 're like a cancer !	cancer
What me and the lads are trying to say , Mr. Cussins , is ... compared to Mr. Revie ... he 's just not good enough .	lads
Hey , hang on a second .	hang on
Maybe if you smelled it , it 'd all come rushing back .	smelled it
I need 200 grand , or I 'm dead .	grand
We meet on an exercise mat at the room 's exact center , she , removing the straps of her heavy clothing in a frenzy of sexual mania while my schoolboy 's uniform is removed with a more controlled and amused deliberation ,	frenzy
Jesus Christ will save your life , lad , if you only let him into your heart !	lad
No follow-up , no exit strategy , it 's a rehab mill .	rehab mill
Guys do it all the time .	guys do it all the time
I did n't get us all the way to the First Division ... so we could sit there mid- table and be cannon fodder for sides like Leeds .	cannon fodder
Look , there 's an attorney in my cigar club .	attorney
I wo n't tell you where they went , but ... get out your pen , ' cause you 're gon na wan na write this down .	gonna wanna
He 's not gon na have one of his meltdowns , is he ?	meltdowns
The man is a rock star .	rock star
You were her excuse for coming here .	excuse
You meet thousands of people , and none of them really touch you .	touch
I ... just saw your mom .	mom
I do n't need this shit from you , Toby .	shit
Maybe before my time maybe .	before my time
You 've got to give them the patter , otherwise they 'll latch on to you .	patter
I think you are watching a few too many movies , zuzu .	zuzu
Well , you know , who 's gon na complain ?	gonna
Home Why I keep returning	infect
Brown nosing or sucker for punishment ?	sucker
We need to discuss this '' mano a mano . ''	mano
And Tm sorry , I did n't wan na stop him .	wanna
My mother passed away a few hours ago .	passed away
It 's gon na take about a minute for the acid to dissipate and your natural morphine to kick in .	kick
You 're gon na make life very difficult for yourself if you do n't , Harvey .	gonna
You kill me here without facing me on the street ... you 'll be known for what you are ...	kill
Nathan , you have n't got ta prove anything , all right ?	gotta
Yeah , well ... everything 's exhausting when you 're past 40 .	yeah
There is a bench right there if you wan na watch .	wanna
- Are your parents gon na get divorced ?	gonna
Well , I was n't expecting you either .	either
You bitch , you 're gon na set me up , are n't you ?	bitch
all right luv , was you i spoke to earlier ?	luv
He can go to hell .	go to hell
`` `` there 's no there , there . '' '' You know ?	thinking
So the stress of it all shows up on our faces , making us look haggard .	haggard
Tall , dark and mysterious or just plain loaded ?	loaded
You got ta learn the one-hitter quitter .	one hitter quitter
You 've been well dipped , buddy .	buddy
Most people here think that they can walk on water .	walk on water
What the fuck is her name ?	uh
getting you back on your feet .	back on your feet
So long as you 're not letting it get to you , Peter , letting it get personal .	get to you
You 'll either never be able to see yourself again , or the world will see what a miserable hag you really are .	hag
The only way we found out about this is because it was tipped to the county sheriff 's office and the police within minutes of it going up .	tipped
Ya 'll lookir double serious with this training and yo ass smokir bitches at Trailer Henge r shit .	bitches
Yeah baby you live here too .	baby
♪ Lady Luck , she is free	lady luck
I 'll pinch some sarnies from the supermarket .	sarnies
I was wondering if you could talk to her and get her to sign these papers .	prenup
My mom is frigging hot .	frigging
I have never done this before , but I 'll talk to the pit boss .	pit boss
I knew him when he was on the dole .	the dole
- I 'm gon na look after my family now .	gonna
Liam and Andy Bell walked in .	kids
Did you just use the L word with Dick ?	the l word
Ma'am , can I ask you a question , and you can tell me to mind me own business , but erm ...	erm
How old were you when you got your cherry popped , Faith ?	cherry popped
If I go 90 on the freeway , I 'll make it .	freeway
Oh , by the way , does French cock taste the same as English ?	cock
- Nobody 's splitting us up , lady .	splitting
Think you got rid of my old man offthat estate ?	old man
What you carrying a shotgun around in your trunk for , dude ?	dude
It was n't exactly a slammer up on the Grand Banks .	slammer
What the hell is goin ' on out there ?	hell
He would n't tell us if he did , 'cause he 's a narcissist .	'cause
- I 'm talking about six Gs here .	blood
I got enough money right here to buy you , your family and a Slurpee .	slurpee
If you are not here on Christmas Eve , you should consider getting a job at Wally 's Whack Shack .	getting a job at wally's whack shack
Excuse me , mate , is there a toilet here ?	mate
- I 'm a fucking Volvo , mate .	mate
- Cos I want you to .	cos
Let me know you 're okay .	okay
You were nicking drinks , but you 've got a yacht ?	nicking
`` survived by his wife of nine years , Judy ,	survived
OK , gently , gently , gently , gently .	ok
I 'm not gon na back out of the franchise deal .	gonna
- A bit draughty on the bum .	bum
You 've got a kid who 's smaller than most .	kid
Q and A 's over , all right ?	q and a
♪ You wan na strap somethin ' else follow me rap ♪	wanna
Well , our motto here is ex corde vita .	ex corde vita
He keeps everything in there , old school .	old school
Oh , my God , I 'm not good with ...	not good
Can you call me back ?	call
Oh c'mon boss , have a bust at this .	have a bust
You 're gon na argue with me over 12 minutes ?	gonna
I already got enough scars , OK , JTRO ?	jtro
He 's like a disabled bloke from home .	bloke
You and Scotty have known each other since birth .	since birth
`` I want to shoot you so bad , my dick 's hard '' ?	dick's hard
I 'm just gon na have a chat with Uncle Pete .	gonna
I smell a remote school .	sick girls
♪ What you gon na do , baby ?	gonna
I thought we 'd try and avoid the A roads , right , and go up the B6255 to Hawes , right , and then cut down through Oughtershaw ,	right
You see , in our world , when someone is born with special wisdom , he shares it with Korrok so that Korrok could be greater .	greater
'Cause growing in Punkton , Kansas ,	‘cause
- Oh , I 'm your boy , huh ?	i'm your boy
You know , I was thinking maybe '' retail slut '' or just '' slut whore . ''	retail slut
But , most importantly , she lied to your dad .	prick
Just the gal I was hoping for .	gal
I mean , I 've only got , like , one spliff left on me .	spliff
Man , you must be crazy as hell if you think I 'm going to see that redneck , man .	redneck
All this crazy shit is not helping .	shit
I 'll go and get it and them , then I 'll come back and get you , yeah ?	yeah
And your name carries a lot of weight , so here she is .	weight
'Cause I like your cock in my pussy .	pussy
My own father was , you might say , a man who was , by natural proclivity , not a good man but who nevertheless tried diligently to be a good man , temper and so forth .	nevertheless
I 'm gon na be the man who 's coming home with you	gonna
Had quite a time of it , have n't you ?	had quite a time of it
The army brainwashed you , man , into believing ... that the invasion was about fucking al-Qaeda ...	man
We have got a prenup .	prenup
All right , once you 're out of here , you 'll get a new girlfriend with bigger tits .	tits
If the dole money is keeping you happy and you 're just trundling along fine with Katie , then do n't do this .	dole
♪ Would n't fall into the blue ♪	into the blue
As you can see , this storm is showing no signs of slowing down !	as you ca see
on the way to nationals :	nationals
Not too much for me , darling .	darling
If you do n't wan na do it , the Universal Dog Home of Brooklyn will .	wanna
I reckon I 'd get a pound a shot for it .	reckon
`` Death Wish '' Fits you down to a T. Perfect !	t a t
- You said you 'd give me a fiver .	fiver
It 's the restaurant we torched .	torched
i do n't wan na do this thing what do you mean you do n't wan na do this ?	wanna
It 's part of Eric 's stash .	stash
We take your soul , baby .	baby
But do n't get me wrong .	phoney people
Let 's give you a cover .	cover
Jonas , if you have to guess of all the positions the elders peek for me .	elders
Because , gee whiz , we all know that prices of houses in America always go up , right ?	gee whiz
Back then you used to see bands when you went out .	went out
We 're just gon na have to beat him , Pete .	gonna
And she 's the one ... she ... she always says that she can save me .	save
Please , man , I did n't take shit .	take shit
Yeah , I talked to him about a week ago .	there are no slangs in this sentence
I 'll make more of an effort to do stuff .	stuff
[ man outside ] What are you gon na do about it ?	what are you gonna do about it
I 'm just , erm , tired and hung over .	erm
They 're on special , two for a dollar .	there are no slangs in this sentence
Listen , mate , I do a very specific kind of music here .	mate
Something we do from time to time .	time to time
Do you want me to tell you the name of your soulmate ?	broke leg
I can feel it in my bones .	bones
We either hang out here for a few days till it calms down ...	hang out
I 'm about to pick some greens for tomorrow .	some greens
Yeah , no , we do read .	yeah
Those with guns , and those with butter .	butter
I think the guvnor just shit himself	guvnor
Can you believe this shit ?	shit
- Mom , Lucas just said , '' Shut up . ''	shut up
Who wants to be the slag in school ?	slag
Hold down the fort , Quentin .	hold down the fort
I ai n't worried about that	ain't
I was steaming with anger .	steaming with anger
I witnessed Federov conspire with CIA agent John Hanley to bomb a civilian building .	witnessed
If you 're the sensitive type , you should n't be here , love .	love
( Scottish accent ) That looks really , really shit .	shit
I said do you wan na move to another country with me ?	wanna
I do n't remember nothir about the other night .	nothir
- But today you do something , huh ?	huh
I will leave them with the stupidity , but I will cut their balls off .	balls
- Look how pissed he is .	pissed
We 'll ride this thing out .	ride
Men coming in and out .	coming
Cuellar and Dobson , they lose to the Pirates in the series .	go figure
Giving him demerol for the pain .	drill
You 're not getting that butt from Barbara Sugarman anytime in the immediate future .	getting that butt
Built you a little fort , huh ?	built
Guys like your old man used to bust their hump working in places like this .	bust their hump
If I show you what 's in this container , you 'll never feel at one with the human race until the day you die .	blow
Yet here I am about to take you down all the same .	take
Let 's have a dry run .	dry run
And we get to have a good time on his dime .	dime
You 're planning to yank $ 42 million ?	yank
And we really , initially , wanted texture in knits , but we realized that dancers probably do n't want to wear , like , hot cashmere .	like
Can I just talk to the orchestra for a second ?	orchestra
Jenny , this one she wanted to be a gymnast .	klutz
Am I gon na have a fucking problem with you ?	gonna
What should I call you , homey ?	homey
The kid would not know the difference whether you 're there or not .	kid
James would probably want to polish his resume a little green .	polish
Hey , how you doing , good-looking ?	good looking
I know it 's a bit long , but you understand why .	long
but who seems to be a very ... ah ... nice young man indeed .	ah
You know , a guy once told me , there 's only three reasons to do anything in this world .	guy
But dang , we had some fun , huh ?	dang
Here , dude , I ca n't unlock it .	dude
Hey , if you need something , hit me up .	hit me up
What the hell is going on ?	hell
Not one person came out of that ground . ltjust lifted everyone .	lifted
♪ Believe I 'm runnin with the ... pack ♪	runnin
SO YOU LET ME LIVE AND TOOK AWAY MY FRIENDS .	balls
I need you to help me save someone .	stay
Solving the following riddle will reveal the awful secret behind the universe , assuming you do not go utterly mad in the attempt .	mad
yeah , a fucking- 30 quid no way- fuck off mate , it 's 30 quid	yeah
He must 've owned Griffin 's too .	owned
do n't want to be back in London , too young to be on the streets	gonna
I 'm gon na hook before I snap .	hook
Ambassador , I 'm gon na need your clothes .	gonna
Pull it the hell over !	pull over pull it the hell over asshole
Forjust the second one , if it 's okay with you , for here , I 'm not gon na use this arm .	okay
You 're a retarded person and you 're driving a fucking car !	retarded
I mean , obviously , there is a mystique ' cause they did lose one along the way .	cause
No witnesses , no security cameras .	poor bastard
- I thought you two were tight .	tight
I do n't know about you , but I 'm happy to sit this one out .	sit this one out
Larry , we both need this fist bump .	fist bump
Daddy , where does the sky end ?	sky end
Um , if you need anything , I 'll be at the office , okay ?	office
One day he 's gon na have loads of cunty kids .	gonna
- Buggered my back , have n't I ?	buggered
And there you can jump in the lake !	you can jump in a lake
This is my love thing .	love thing
I first seen him at The Cliff , playing in a game , and he was one of them players that you just ,	them players
You must take me for some kind of fool .	fool
- Every guy watches porn every day .	porn
Screwed anything that was n't nailed down and drank his into the O.R .	screwed
♪ From the first half fever Till the cold goodbye ♪	till
Who the hell are you calling '' bitch '' ?	bitch
What they 're gon na do to him is really bad .	gonna
- Oh , honey , what was it called ?	honey
But the cop who was trying to get the story said that she was pretty incoherent , just that a man forced his way into the house with a gun and was searching for something .	cop
For your own safety , trust me on that one .	trust me
It does n't do any good .	do any good
Maybe he has n't found something to believe in .	something to believe in
Sergeant Craven and PC Douglas are on the mend , but they 're not up to questioning just yet .	on the mend
I want you to find the men who did this , and bring them to me .	hundred
- But if you get to know me , I am an ok guy .	ok
' .. have again embarked on a hunger strike after the Home Secretary refused ... '	hunger strike
Okay , let 's blow this joint :	blow this joint
Talk to me , Billy , over .	yankee
No , it 's just because he ends up going sideways	sideways
Know how they say , '' The hills have eyes '' ?	hills have eyes
The violent expedition of my love has outrun the pauser reason .	bloody
True love is your soul 's recognition of its counterpoint another .	true
( door opening ) ... a self-absorbed prat .	prat
It 's good to be beside , innit ?	innit
I 'll be there in a second .	in a second
Get your kid out , please .	kid
With Clark in , I think we 're in good shape .	shape
